<?xml version="1.0" encoding="UTF-8"?>
<etapa xmlns="http://www.uniovi.es" xmlns:xsi="http://www.w3.org/2001/XMLSchema-instance" xsi:schemaLocation="http://www.uniovi.es etapa.xsd">
    <nombre>Carrefour Granada - Granada</nombre>
    <numero>21</numero>
    <longitud-etapa unidades="kilómetros">112</longitud-etapa>
    <fecha>2026-09-13</fecha>
    <tiempo-ganador>PT03H07M09S</tiempo-ganador>
    <velocidad-ganador unidades="Km/h">35.9</velocidad-ganador>
    <desnivel unidades="metros">1217</desnivel>
    <ciudad-inicio>Carrefour Granada</ciudad-inicio>
    <ciudad-meta>Granada</ciudad-meta>
    <tipo>Llana</tipo>
    <referencias>
        <referencia>https://www.lavuelta.es/es/etapa-21</referencia>
        <referencia>Libro de Ruta La Vuelta 2026</referencia>
        <referencia>https://www.esciclismo.com/actualidad/carretera/93042.html</referencia>
        <referencia>https://www.ivoox.com/vuelta-2026-etapa-21-audios-mp3_rf_180499626_1.html</referencia>
    </referencias>
    <fotos>
        <foto>Foto-ganador-etapa.jpg</foto>
        <foto>Entrada-ganador-general.jpg</foto>
        <foto>Grupo-corredores.jpg</foto>
    </fotos>
    <videos>
        <video>LastKm-Stage21_LaVuelta26.mp4</video>
    </videos>
    <podcasts>
        <podcast>Podcast-oficial-LaVuelta2026.mp3</podcast>
    </podcasts>
    <!-- Coordenadas reales de Granada para la Salida y Meta -->
    <lugar-salida>
        <longitud unidades="grados">-3.6079</longitud>
        <latitud unidades="grados">37.1550</latitud>
        <altitud unidades="metros">664.0</altitud>
    </lugar-salida>
    <lugar-meta>
        <longitud unidades="grados">-3.5931</longitud>
        <latitud unidades="grados">37.1698</latitud>
        <altitud unidades="metros">670.6</altitud>
    </lugar-meta>
    
    <hitos>
        <sprint-intermedio>
            <longitud unidades="grados">-3.5942</longitud>
            <latitud unidades="grados">37.1697</latitud>
            <altitud unidades="metros">669.0</altitud>
            <distancia-salida unidades="kilómetros">92.4</distancia-salida>
        </sprint-intermedio>
    </hitos>
    
    <puntos-anon>
        <punto-anon>
            <nombre-punto>Salida Vuelta</nombre-punto>
            <longitud unidades="grados">-3.6079</longitud>
            <latitud unidades="grados">37.1550</latitud>
            <altitud unidades="metros">664.0</altitud>
            <distancia-salida unidades="kilómetros">0.0</distancia-salida>
        </punto-anon>
        <punto-anon>
            <longitud unidades="grados">-3.6073</longitud>
            <latitud unidades="grados">37.1546</latitud>
            <altitud unidades="metros">664.0</altitud>
            <distancia-salida unidades="kilómetros">0.1</distancia-salida>
        </punto-anon>
        <punto-anon>
            <longitud unidades="grados">-3.6074</longitud>
            <latitud unidades="grados">37.1545</latitud>
            <altitud unidades="metros">664.0</altitud>
            <distancia-salida unidades="kilómetros">0.1</distancia-salida>
        </punto-anon>
        <punto-anon>
            <longitud unidades="grados">-3.6072</longitud>
            <latitud unidades="grados">37.1543</latitud>
            <altitud unidades="metros">664.0</altitud>
            <distancia-salida unidades="kilómetros">0.1</distancia-salida>
        </punto-anon>
        <punto-anon>
            <longitud unidades="grados">-3.6068</longitud>
            <latitud unidades="grados">37.1548</latitud>
            <altitud unidades="metros">665.6</altitud>
            <distancia-salida unidades="kilómetros">0.2</distancia-salida>
        </punto-anon>
        <punto-anon>
            <longitud unidades="grados">-3.6090</longitud>
            <latitud unidades="grados">37.1560</latitud>
            <altitud unidades="metros">662.3</altitud>
            <distancia-salida unidades="kilómetros">0.4</distancia-salida>
        </punto-anon>
        <punto-anon>
            <longitud unidades="grados">-3.6096</longitud>
            <latitud unidades="grados">37.1558</latitud>
            <altitud unidades="metros">662.6</altitud>
            <distancia-salida unidades="kilómetros">0.5</distancia-salida>
        </punto-anon>
        <punto-anon>
            <longitud unidades="grados">-3.6123</longitud>
            <latitud unidades="grados">37.1532</latitud>
            <altitud unidades="metros">663.0</altitud>
            <distancia-salida unidades="kilómetros">0.8</distancia-salida>
        </punto-anon>
        <punto-anon>
            <longitud unidades="grados">-3.6125</longitud>
            <latitud unidades="grados">37.1526</latitud>
            <altitud unidades="metros">663.0</altitud>
            <distancia-salida unidades="kilómetros">0.9</distancia-salida>
        </punto-anon>
        <punto-anon>
            <longitud unidades="grados">-3.6130</longitud>
            <latitud unidades="grados">37.1524</latitud>
            <altitud unidades="metros">663.4</altitud>
            <distancia-salida unidades="kilómetros">0.9</distancia-salida>
        </punto-anon>
        <punto-anon>
            <longitud unidades="grados">-3.6107</longitud>
            <latitud unidades="grados">37.1458</latitud>
            <altitud unidades="metros">668.4</altitud>
            <distancia-salida unidades="kilómetros">1.7</distancia-salida>
        </punto-anon>
        <punto-anon>
            <longitud unidades="grados">-3.6202</longitud>
            <latitud unidades="grados">37.1383</latitud>
            <altitud unidades="metros">675.0</altitud>
            <distancia-salida unidades="kilómetros">2.9</distancia-salida>
        </punto-anon>
        <punto-anon>
            <longitud unidades="grados">-3.6355</longitud>
            <latitud unidades="grados">37.1420</latitud>
            <altitud unidades="metros">669.1</altitud>
            <distancia-salida unidades="kilómetros">4.3</distancia-salida>
        </punto-anon>
        <punto-anon>
            <longitud unidades="grados">-3.6377</longitud>
            <latitud unidades="grados">37.1418</latitud>
            <altitud unidades="metros">669.4</altitud>
            <distancia-salida unidades="kilómetros">4.5</distancia-salida>
        </punto-anon>
        <punto-anon>
            <longitud unidades="grados">-3.6398</longitud>
            <latitud unidades="grados">37.1431</latitud>
            <altitud unidades="metros">666.8</altitud>
            <distancia-salida unidades="kilómetros">4.8</distancia-salida>
        </punto-anon>
        <punto-anon>
            <longitud unidades="grados">-3.6519</longitud>
            <latitud unidades="grados">37.1467</latitud>
            <altitud unidades="metros">657.0</altitud>
            <distancia-salida unidades="kilómetros">6.0</distancia-salida>
        </punto-anon>
        <punto-anon>
            <longitud unidades="grados">-3.6518</longitud>
            <latitud unidades="grados">37.1506</latitud>
            <altitud unidades="metros">651.2</altitud>
            <distancia-salida unidades="kilómetros">6.4</distancia-salida>
        </punto-anon>
        <punto-anon>
            <longitud unidades="grados">-3.6443</longitud>
            <latitud unidades="grados">37.1511</latitud>
            <altitud unidades="metros">650.0</altitud>
            <distancia-salida unidades="kilómetros">7.1</distancia-salida>
        </punto-anon>
        <punto-anon>
            <longitud unidades="grados">-3.6306</longitud>
            <latitud unidades="grados">37.1493</latitud>
            <altitud unidades="metros">654.0</altitud>
            <distancia-salida unidades="kilómetros">8.3</distancia-salida>
        </punto-anon>
        <punto-anon>
            <longitud unidades="grados">-3.6263</longitud>
            <latitud unidades="grados">37.1499</latitud>
            <altitud unidades="metros">656.0</altitud>
            <distancia-salida unidades="kilómetros">8.7</distancia-salida>
        </punto-anon>
        <punto-anon>
            <longitud unidades="grados">-3.6217</longitud>
            <latitud unidades="grados">37.1533</latitud>
            <altitud unidades="metros">654.0</altitud>
            <distancia-salida unidades="kilómetros">9.2</distancia-salida>
        </punto-anon>
        <punto-anon>
            <longitud unidades="grados">-3.6136</longitud>
            <latitud unidades="grados">37.1532</latitud>
            <altitud unidades="metros">661.6</altitud>
            <distancia-salida unidades="kilómetros">10.0</distancia-salida>
        </punto-anon>
        <punto-anon>
            <longitud unidades="grados">-3.6105</longitud>
            <latitud unidades="grados">37.1457</latitud>
            <altitud unidades="metros">668.4</altitud>
            <distancia-salida unidades="kilómetros">10.9</distancia-salida>
        </punto-anon>
        <punto-anon>
            <longitud unidades="grados">-3.6089</longitud>
            <latitud unidades="grados">37.1464</latitud>
            <altitud unidades="metros">670.0</altitud>
            <distancia-salida unidades="kilómetros">11.1</distancia-salida>
        </punto-anon>
        <punto-anon>
            <longitud unidades="grados">-3.6080</longitud>
            <latitud unidades="grados">37.1469</latitud>
            <altitud unidades="metros">673.0</altitud>
            <distancia-salida unidades="kilómetros">11.2</distancia-salida>
        </punto-anon>
        <punto-anon>
            <longitud unidades="grados">-3.6064</longitud>
            <latitud unidades="grados">37.1449</latitud>
            <altitud unidades="metros">675.0</altitud>
            <distancia-salida unidades="kilómetros">11.5</distancia-salida>
        </punto-anon>
        <punto-anon>
            <longitud unidades="grados">-3.6043</longitud>